Incident Number,Severity,Severity Level,Date,Location,Pipeline Operator,Material Released,PHMSA Guide Reference,Incident Description,Response Actions,Casualties & Injuries
117,🟠 Moderate,Moderate,"May 16, 2022","Corpus Christi, Texas",XYZ Pipeline Company,None (Fire Event),Guide 115,"A lightning strike hit a vent stack at a gas processing facility, igniting residual gas vapors and triggering a fire.","Fire suppression systems activated immediately.
Lightning protection enhanced at the processing facility.
Vapor recovery system improved to prevent residual gas accumulation.",No injuries reported.
118,⚪ Near Miss / No Impact,,"October 29, 2022","New Orleans, Louisiana",XYZ Pipeline Company,Diesel Fuel (UN 1202),Guide 128,"A weld repair on a diesel pipeline failed prematurely, leading to a small but continuous fuel leak.","Pipeline section isolated and weld repair redone using improved techniques.
Quality control for welding procedures enhanced.
Post-repair pipeline integrity monitoring increased.",No injuries reported.
119,⚪ Near Miss / No Impact,,"December 14, 2023","Tulsa, Oklahoma",XYZ Pipeline Company,Liquefied Petroleum Gas (LPG) (UN 1075),Guide 115,A leaking valve packing on an LPG metering station resulted in a small but detectable gas release.,"Station shut down, and valve packing replaced.
Routine valve inspections increased to detect early failures.",No injuries reported.
120,🟡 Minor,Minor,"February 2, 2024","Oklahoma City, Oklahoma",XYZ Pipeline Company,None (Security Event),N/A,"Security teams detected unauthorized personnel attempting to enter a secured pipeline facility, leading to an investigation.","Local law enforcement notified, and intruders apprehended.
Surveillance system upgraded with motion detection.
Security training reinforced for facility personnel.",No injuries reported.
121,🟡 Minor,Minor,"April 19, 2022","Houston, Texas",XYZ Pipeline Company,Natural Gas (UN 1971),Guide 115,"A compressor station reported a minor gas leak, traced back to worn-out sealing components in one of the units.","Compressor unit shut down, and all seals replaced.
Leak monitoring frequency increased at the station.
Maintenance schedule updated for early detection of worn seals.",No injuries reported.
122,🟡 Minor,Minor,"August 12, 2023","Midland, Texas",XYZ Pipeline Company,Crude Oil (UN 1267),Guide 128,"Heavy rain and soil movement caused stress on a buried pipeline section, resulting in a pinhole leak.","Pipeline shut down, and affected section excavated and repaired.
Geotechnical stabilization conducted in the area.
Regular inspections implemented for soil stability monitoring.",No injuries reported.
123,🟡 Minor,Minor,"May 7, 2022","Denver, Colorado",XYZ Pipeline Company,Liquefied Petroleum Gas (LPG) (UN 1075),Guide 115,"An operator misaligned a valve during a transfer operation, causing an unintentional LPG release.","Transfer operations stopped immediately.
Valve alignment procedures reinforced through staff training.
Automated valve monitoring installed to prevent misalignments.",No injuries reported.
124,🟡 Minor,Minor,"September 15, 2021","Cheyenne, Wyoming",XYZ Pipeline Company,Natural Gas (UN 1971),Guide 115,A pressure regulator malfunction at a compressor station led to temporary overpressure in a downstream pipeline segment.,"Pressure relief valves activated automatically.
Regulator station shut down and recalibrated.
Preventive maintenance schedules adjusted for all pressure regulators.",No injuries reported.
125,🟡 Minor,Minor,"February 6, 2023","Pittsburgh, Pennsylvania",XYZ Pipeline Company,None (Near Miss),Guide 128,"A construction company failed to verify underground pipelines before digging, narrowly avoiding damaging a crude oil transmission pipeline.","Work halted, and regulatory authorities notified.
Public awareness campaign launched about safe excavation near pipelines.
Excavation companies required to undergo additional safety training.",No injuries reported.
126,🟡 Minor,Minor,"October 21, 2022","Baton Rouge, Louisiana",XYZ Pipeline Company,Diesel Fuel (UN 1202),Guide 128,"An aging section of pipeline developed a small leak, allowing diesel fuel to seep into nearby soil.","Pipeline section isolated, and contaminated soil removed.
Aging pipeline infrastructure prioritized for replacement.
Long-term monitoring for potential future leaks in the area.",No injuries reported.
127,🟠 Moderate,Moderate,"July 14, 2023","Corpus Christi, Texas",XYZ Pipeline Company,None (Fire Event),Guide 115,"A lubrication system failure in a compressor unit caused overheating, igniting nearby residues and triggering a fire.","Fire suppression system activated immediately.
Lubrication systems inspected and maintenance procedures improved.
Temperature monitoring sensors added to detect overheating early.",No injuries reported.
128,⚪ Near Miss / No Impact,,"January 3, 2023","New Orleans, Louisiana",XYZ Pipeline Company,Jet Fuel (UN 1863),Guide 128,A faulty hose coupling during fuel transfer operations resulted in a small spill of jet fuel at a loading terminal.,"Operations stopped, and fuel spill contained.
Defective hose coupling replaced with an upgraded design.
Routine coupling integrity testing added to maintenance procedures.",No injuries reported.
129,🟡 Minor,Minor,"May 29, 2021","Tulsa, Oklahoma",XYZ Pipeline Company,Natural Gas (UN 1971),Guide 115,"A third-party excavation crew struck a high-pressure natural gas pipeline, causing an immediate rupture and gas release.","Pipeline shutdown and emergency responders deployed.
Excavation company fined for non-compliance with safety regulations.
Public safety training reinforced for excavation crews.",Two workers suffered minor injuries from debris impact.
130,🟡 Minor,Minor,"March 7, 2024","Oklahoma City, Oklahoma",XYZ Pipeline Company,Hydrogen Sulfide (UN 1053),Guide 117,"A valve failure in a sour gas processing unit led to a hydrogen sulfide (H₂S) gas release, triggering alarm systems.","Facility evacuated, and emergency response teams deployed.
Gas dispersion monitored, and ventilation system engaged.
Valve replaced, and maintenance procedures improved.",One worker suffered mild respiratory distress and received treatment on-site.
131,🟡 Minor,Minor,"June 15, 2022","Houston, Texas",XYZ Pipeline Company,Natural Gas (UN 1971),Guide 115,A compressor station detected a gas leak caused by a failing gasket in the high-pressure pipeline connection.,"Compressor unit isolated, and faulty gasket replaced.
All gaskets inspected and reinforced where necessary.
Routine gasket integrity checks added to maintenance protocols.",No injuries reported.
132,🟡 Minor,Minor,"August 19, 2023","Midland, Texas",XYZ Pipeline Company,Diesel Fuel (UN 1202),Guide 128,A hose rupture during a routine fuel transfer operation resulted in a minor diesel spill at a pump station.,"Pumping operations halted, and spill contained using absorbent materials.
Hose replaced, and quality control procedures reviewed.
Routine hose inspections increased to prevent future failures.",No injuries reported.
133,🟡 Minor,Minor,"March 3, 2021","Denver, Colorado",XYZ Pipeline Company,None (Near Miss),Guide 128,"A third-party excavation crew failed to check for underground pipelines, scraping the protective coating of an oil pipeline without causing a leak.","Pipeline operators conducted integrity assessments to confirm no damage.
Excavation crew fined for violating dig safety regulations.
Public awareness campaign launched for excavation safety.",No injuries reported.
134,🟠 Moderate,Moderate,"September 11, 2022","Cheyenne, Wyoming",XYZ Pipeline Company,None (Fire Event),Guide 115,"A turbocharger in a compressor unit overheated, leading to a small fire in the engine compartment.","Fire suppression system activated automatically.
Station shut down for inspection and repairs.
Additional cooling systems installed to prevent future overheating.",No injuries reported.
135,🟡 Minor,Minor,"December 28, 2023","Pittsburgh, Pennsylvania",XYZ Pipeline Company,Liquefied Petroleum Gas (LPG) (UN 1075),Guide 115,"A sudden pressure spike in an LPG pipeline caused a pipeline rupture, leading to an uncontrolled release of gas.","Emergency shutdown activated, and pipeline section isolated.
Gas dispersion monitored before allowing reentry.
Pressure control systems inspected and recalibrated.",No injuries reported.
136,🟡 Minor,Minor,"July 8, 2021","Baton Rouge, Louisiana",XYZ Pipeline Company,Crude Oil (UN 1267),Guide 128,"A series of heavy rains caused minor ground shifting, leading to a stress fracture in an underground oil pipeline.","Pipeline section isolated, and oil spill contained.
Geotechnical assessments conducted to evaluate soil stability.
Pipeline reinforced with additional support structures.",No injuries reported.
137,🟡 Minor,Minor,"May 17, 2023","Corpus Christi, Texas",XYZ Pipeline Company,Natural Gas (UN 1971),Guide 115,"A faulty control valve failed to regulate pressure, causing an overpressure event in the gas transmission system.","Emergency venting system activated to relieve excess pressure.
Control valve replaced and recalibrated.
Pipeline pressure monitoring upgraded for early detection.",No injuries reported.
138,🟡 Minor,Minor,"January 15, 2024","Oklahoma City, Oklahoma",XYZ Pipeline Company,None (Security Concern),N/A,"Security cameras captured unauthorized individuals attempting to breach a secured pipeline facility, prompting a response from security teams.","Local law enforcement notified, and security personnel deployed.
Surveillance and alarm systems upgraded at the facility.
Security training for staff reinforced to respond to potential threats.",No injuries reported.
139,🟡 Minor,Minor,"October 23, 2022","Tulsa, Oklahoma",XYZ Pipeline Company,Natural Gas (UN 1971),Guide 115,"A seal failure in an underground storage well caused a minor but persistent natural gas leak, detected through monitoring systems.","Storage facility operations halted, and leak sealed.
Seals replaced, and well integrity testing conducted.
Preventive maintenance schedule increased for all storage wells.",No injuries reported.
140,🟡 Minor,Minor,"February 11, 2023","New Orleans, Louisiana",XYZ Pipeline Company,Crude Oil (UN 1267),Guide 128,"A faulty seal in a crude oil pump system at a transfer station resulted in a spill of 5,000 gallons of oil.","Transfer operations halted, and spilled oil contained.
Pump seal replaced and monitored for further leaks.
Routine inspections increased for all transfer equipment.",No injuries reported.
141,🟡 Minor,Minor,"June 22, 2023","Houston, Texas",XYZ Pipeline Company,Natural Gas (UN 1971),Guide 115,"A compressor station experienced an unplanned shutdown due to a malfunctioning gas control valve, leading to a minor leak before the station was depressurized.","Emergency shutdown initiated, and affected pipeline section isolated.
Control valve repaired and system recalibrated.
Compressor station maintenance frequency increased.",No injuries reported.
142,⚪ Near Miss / No Impact,,"August 30, 2021","Midland, Texas",XYZ Pipeline Company,Diesel Fuel (UN 1202),Guide 128,"A routine pipeline inspection detected external corrosion, which resulted in a small diesel leak into the soil.","Pipeline shutdown and spill containment measures activated.
Pipeline section excavated and corroded segment replaced.
Corrosion control measures, including cathodic protection, reinforced.",No injuries reported.
143,🟡 Minor,Minor,"March 5, 2022","Denver, Colorado",XYZ Pipeline Company,Crude Oil (UN 1267),Guide 128,"A pressure sensor failure in an oil transmission pipeline led to a temporary overpressure event, triggering emergency shutdown protocols.","Automated relief system activated to safely release excess pressure.
Sensor replaced and pressure monitoring system recalibrated.
Preventive maintenance schedule updated for pressure control devices.",No injuries reported.
144,🟡 Minor,Minor,"October 12, 2022","Cheyenne, Wyoming",XYZ Pipeline Company,None (Near Miss),Guide 115,A construction crew operating heavy machinery was discovered digging within 20 feet of a high-pressure gas transmission pipeline without proper authorization.,"Excavation work halted, and crew removed from the site.
Pipeline integrity assessment conducted to ensure no damage.
Regulatory fines issued against the contractor.",No injuries reported.
145,🟠 Moderate,Moderate,"July 4, 2023","Pittsburgh, Pennsylvania",XYZ Pipeline Company,None (Fire Event),Guide 115,A short circuit in a processing facility’s electrical panel resulted in a small fire in the control room.,"Fire suppression system activated, preventing damage to gas processing equipment.
Electrical panel inspected, replaced, and facility power restored.
Routine electrical system checks reinforced to detect early failures.",No injuries reported.
146,🟡 Minor,Minor,"November 14, 2021","Baton Rouge, Louisiana",XYZ Pipeline Company,Natural Gas (UN 1971),Guide 115,"A tree root penetrated the protective coating of an underground gas pipeline, leading to external corrosion and a slow leak.","Pipeline shutdown, and affected section excavated and repaired.
Vegetation management protocols reviewed and updated.
Tree root barriers installed along pipeline right-of-way.",No injuries reported.
147,⚪ Near Miss / No Impact,,"May 27, 2023","Corpus Christi, Texas",XYZ Pipeline Company,Liquefied Petroleum Gas (LPG) (UN 1075),Guide 115,"A previously repaired pipeline weld failed under pressure, leading to a small LPG release, which was detected via remote monitoring.","Pipeline section isolated and emergency repair conducted.
Welding standards reviewed and quality control procedures enhanced.
Pipeline integrity testing expanded for recent weld repairs.",No injuries reported.
148,🟠 Moderate,Moderate,"January 9, 2023","New Orleans, Louisiana",XYZ Pipeline Company,None (Fire Event),Guide 128,"A lightning strike ignited residual vapors around an oil storage tank, leading to a small fire that was contained within minutes.","Fire suppression system activated automatically.
Storage tank integrity inspection conducted before resuming operations.
Additional lightning protection installed at the facility.",No injuries reported.
149,🟡 Minor,Minor,"August 22, 2021","Tulsa, Oklahoma",XYZ Pipeline Company,Crude Oil (UN 1267),Guide 128,"A pipeline segment with structural fatigue developed a stress crack, leading to a slow oil leak that was detected during a routine patrol.","Pipeline section shut down, and leak contained.
Aging pipeline sections prioritized for replacement.
Enhanced pipeline integrity testing scheduled.",No injuries reported.
150,🟡 Minor,Minor,"March 19, 2024","Oklahoma City, Oklahoma",XYZ Pipeline Company,Hydrogen Sulfide (UN 1053),Guide 117,"A control valve failure in a sour gas processing unit led to a hydrogen sulfide gas release, triggering emergency response protocols.","Facility personnel evacuated, and emergency responders deployed.
Gas dispersion monitored before allowing personnel reentry.
Valve replaced, and enhanced leak detection systems installed.","One worker suffered minor respiratory distress, treated on-site."
151,⚪ Near Miss / No Impact,,"May 10, 2023","Houston, Texas",XYZ Pipeline Company,Natural Gas (UN 1971),Guide 115,"A pressure relief valve failed to reseat properly, leading to a small but continuous gas release detected by monitoring systems.","Pipeline section isolated, and faulty valve replaced.
All similar valves inspected and recalibrated.
Preventive maintenance program updated for valve integrity monitoring.",No injuries reported.
152,🟡 Minor,Minor,"August 28, 2021","Midland, Texas",XYZ Pipeline Company,Diesel Fuel (UN 1202),Guide 128,"A diesel storage tank at a pump station was accidentally overfilled, causing fuel to spill into the secondary containment system.","Operations halted, and excess diesel recovered.
Automated level monitoring installed to prevent overfills.
Training program reinforced for proper fuel transfer procedures.",No injuries reported.
153,🟡 Minor,Minor,"April 5, 2022","Denver, Colorado",XYZ Pipeline Company,None (Near Miss),Guide 115,"A construction crew working near a gas pipeline failed to confirm its exact location, scraping the protective coating but avoiding a rupture.","Pipeline operators conducted integrity assessments and recoated the pipeline.
Excavation contractor fined for non-compliance.
Additional safety awareness sessions scheduled for construction teams.",No injuries reported.
154,🟠 Moderate,Moderate,"October 20, 2023","Cheyenne, Wyoming",XYZ Pipeline Company,None (Fire Event),Guide 115,"An electrical fault in a compressor control panel caused a small fire, temporarily disrupting station operations.","Fire suppression system activated and fire contained.
Electrical panels inspected and damaged components replaced.
Routine electrical inspections reinforced.",No injuries reported.
155,🟡 Minor,Minor,"January 2, 2022","Pittsburgh, Pennsylvania",XYZ Pipeline Company,Liquefied Petroleum Gas (LPG) (UN 1075),Guide 115,"A pressure control system failure led to excessive pressure buildup, rupturing a section of an LPG transmission pipeline.","Pipeline shutdown, and affected section isolated.
Automated relief valves upgraded for improved response times.
Pipeline pressure control systems recalibrated.",No injuries reported.
156,🟡 Minor,Minor,"July 14, 2021","Baton Rouge, Louisiana",XYZ Pipeline Company,Crude Oil (UN 1267),Guide 128,"A pump system failure resulted in backflow and leakage from an oil pipeline, triggering emergency shutdown procedures.","Pipeline operations halted, and leaked oil contained.
Pump system repaired and tested for further failures.
Emergency shutdown protocols reviewed and refined.",No injuries reported.
157,🟡 Minor,Minor,"May 25, 2023","Corpus Christi, Texas",XYZ Pipeline Company,Natural Gas (UN 1971),Guide 115,"A glitch in the SCADA (Supervisory Control and Data Acquisition) system caused incorrect valve positioning, leading to temporary overpressure in a transmission pipeline.","Automated relief system activated.
SCADA software updated and additional safety failsafes implemented.
Personnel training increased on system failure response.",No injuries reported.
158,🟠 Moderate,Moderate,"January 18, 2023","New Orleans, Louisiana",XYZ Pipeline Company,None (Fire Event),Guide 128,"A lightning strike hit the control building of a pump station, igniting minor electrical fires inside.","Fire suppression system activated automatically.
Electrical panels inspected and replaced.
Lightning protection system upgraded.",No injuries reported.
159,🟡 Minor,Minor,"September 9, 2021","Tulsa, Oklahoma",XYZ Pipeline Company,Crude Oil (UN 1267),Guide 128,"A pump operator failed to close a valve properly, causing crude oil to be pumped beyond capacity, resulting in a spill.","Transfer operations halted, and spill contained.
Pump operators retrained on proper transfer procedures.
Additional automated shutoffs installed to prevent overfilling.",No injuries reported.
160,🟡 Minor,Minor,"March 10, 2024","Oklahoma City, Oklahoma",XYZ Pipeline Company,Hydrogen Sulfide (UN 1053),Guide 117,"A processing plant experienced a failure in its pressure relief system, resulting in a hydrogen sulfide gas release into the facility.","Emergency alarms activated, and facility personnel evacuated.
Gas dispersion monitored, and ventilation system engaged.
Pressure relief system reviewed and upgraded to prevent recurrence.","One worker suffered minor exposure symptoms, treated on-site."
161,⚪ Near Miss / No Impact,,"June 5, 2023","Houston, Texas",XYZ Pipeline Company,Natural Gas (UN 1971),Guide 115,"A manufacturing defect in a pipeline seam resulted in a small but continuous natural gas leak, detected through aerial infrared surveys.","Pipeline section isolated, and defective seam repaired.
All similar pipeline sections inspected for potential weaknesses.
Pipeline manufacturing standards reviewed and reinforced.",No injuries reported.
162,🟡 Minor,Minor,"August 10, 2021","Midland, Texas",XYZ Pipeline Company,Diesel Fuel (UN 1202),Guide 128,"A transfer hose ruptured during fuel transfer operations, spilling approximately 1,500 gallons of diesel fuel within the secondary containment area.","Operations stopped, and spill contained using absorbent materials.
All hoses inspected for potential defects and weak points.
Routine hose pressure testing procedures strengthened.",No injuries reported.
163,🟡 Minor,Minor,"April 21, 2022","Denver, Colorado",XYZ Pipeline Company,None (Near Miss),Guide 128,A contractor conducting roadwork unknowingly began excavating near an active crude oil transmission pipeline without notifying the operator.,"Excavation work halted immediately.
Pipeline integrity verified to confirm no damage.
Regulatory fines issued, and excavation safety training mandated.",No injuries reported.
164,🟠 Moderate,Moderate,"October 15, 2023","Cheyenne, Wyoming",XYZ Pipeline Company,None (Fire Event),Guide 115,"A lubrication pump failure caused excessive friction in a gas compressor unit, leading to a small fire within the compressor housing.","Fire suppression system activated, preventing spread.
Lubrication system replaced and preventive measures reviewed.
Thermal sensors installed to detect early overheating signs.",No injuries reported.
165,🟡 Minor,Minor,"January 8, 2022","Pittsburgh, Pennsylvania",XYZ Pipeline Company,Liquefied Petroleum Gas (LPG) (UN 1075),Guide 115,"A sudden temperature drop caused thermal stress in an LPG pipeline, leading to a rupture and gas release.","Pipeline operations halted, and emergency response initiated.
Pipeline reinforced with temperature-resistant materials.
Weather-based operational adjustments implemented.",No injuries reported.
166,🟡 Minor,Minor,"July 19, 2021","Baton Rouge, Louisiana",XYZ Pipeline Company,Crude Oil (UN 1267),Guide 128,"A storage tank developed a crack due to long-term structural fatigue, causing a crude oil leak of approximately 10,000 gallons.","Spill containment activated, and oil recovered.
Tank integrity assessed, and structural reinforcement implemented.
Routine stress testing added for storage tanks.",No injuries reported.
167,🟡 Minor,Minor,"May 11, 2023","Corpus Christi, Texas",XYZ Pipeline Company,Natural Gas (UN 1971),Guide 115,"A SCADA (Supervisory Control and Data Acquisition) system error resulted in delayed pressure relief activation, causing a temporary overpressure event.","Automated relief system activated manually by operators.
SCADA software updated to improve response time.
Additional operator training conducted for manual intervention.",No injuries reported.
168,🟠 Moderate,Moderate,"February 2, 2023","New Orleans, Louisiana",XYZ Pipeline Company,None (Fire Event),Guide 128,"A lightning strike at a crude oil storage facility ignited vapors near a tank vent, causing a small fire that was contained within minutes.","Fire suppression system activated, preventing further damage.
Lightning protection system upgraded at the facility.
Tank venting procedures reviewed to reduce vapor accumulation.",No injuries reported.
169,⚪ Near Miss / No Impact,,"September 3, 2021","Tulsa, Oklahoma",XYZ Pipeline Company,Crude Oil (UN 1267),Guide 128,"An aging pipeline segment developed a small crack, leading to a crude oil leak detected by remote monitoring systems.","Pipeline section shut down, and oil spill contained.
Aging pipeline replacement project accelerated.
Leak detection system enhanced for older pipeline sections.",No injuries reported.
170,🟡 Minor,Minor,"March 4, 2024","Oklahoma City, Oklahoma",XYZ Pipeline Company,Hydrogen Sulfide (UN 1053),Guide 117,"A pressure valve malfunction in a sour gas processing unit caused a brief hydrogen sulfide gas release, prompting emergency evacuation.","Facility personnel evacuated, and emergency response teams deployed.
Gas dispersion monitored to ensure safety before reentry.
Pressure control systems reviewed and reinforced.","One worker experienced mild exposure symptoms, treated on-site."
171,🟡 Minor,Minor,"June 14, 2023","Houston, Texas",XYZ Pipeline Company,Natural Gas (UN 1971),Guide 115,"A recently welded pipeline joint failed under pressure, resulting in a minor but continuous gas leak, detected by remote monitoring.","Pipeline section isolated, and weld repaired.
Inspection of all recent welding work conducted.
Enhanced training provided to welding personnel.",No injuries reported.
172,🟡 Minor,Minor,"August 5, 2021","Midland, Texas",XYZ Pipeline Company,Diesel Fuel (UN 1202),Guide 128,"A faulty pressure relief valve on a loading arm failed to close properly, causing diesel fuel to overflow onto the terminal floor.","Operations halted, and spill contained using absorbent materials.
Faulty valve replaced and tested.
Additional safety inspections scheduled for all terminal equipment.",No injuries reported.
173,🟡 Minor,Minor,"April 17, 2022","Denver, Colorado",XYZ Pipeline Company,None (Near Miss),Guide 115,"A construction crew operating heavy machinery started digging without verifying the location of underground pipelines, endangering a high-pressure gas line.","Excavation work halted, and crew removed from site.
Pipeline integrity verified to confirm no damage.
Regulatory fines issued, and additional training mandated.",No injuries reported.
174,🟠 Moderate,Moderate,"October 25, 2023","Cheyenne, Wyoming",XYZ Pipeline Company,None (Fire Event),Guide 115,"An electrical panel in the compressor station short-circuited, igniting a small fire inside the control room.","Fire suppression system activated, preventing further spread.
Electrical panel replaced, and station power restored.
Regular electrical safety audits scheduled.",No injuries reported.
